{
  "$schema": "http://json-schema.org/draft-07/schema#",
  "type": "object",
  "properties": {
    "delivery": {
      "type": "object",
      "properties": {
        "fileName": {
          "type": "string"
        },
        "id": {
          "type": "integer",
          "minimum": 0
        },
        "sentAt": {
          "type": "string",
          "format": "date"
        },
        "from": {
          "type": "string",
          "maxLength": 2
        },
        "to": {
          "type": "string"
        }
      },
      "required": ["fileName", "id", "sentAt", "from", "to"]
    },
    "bizTalkPipe": {
      "type": "string"
    },
    "invoiceNumber": {
      "type": "integer",
      "minimum": 0
    },
    "refundedInvoiceNumber": {
      "type": ["integer", "null"]
    },
    "invoiceDate": {
      "type": "string",
      "format": "date"
    },
    "dueDate": {
      "type": "string",
      "format": "date"
    },
    "receiptDate": {
      "type": "string",
      "format": "date"
    },
    "grossSum": {
      "type": "number",
      "minimum": 0
    },
    "currency": {
      "type": "string",
      "maxLength": 3
    },
    "ourReference": {
      "type": "string"
    },
    "customerBankReference": {
      "type": ["string", "null"]
    },
    "periodStartDate": {
      "type": ["string", "null"],
      "format": "date"
    },
    "periodEndDate": {
      "type": ["string", "null"],
      "format": "date"
    },
    "paymentPeriodStartDate": {
      "type": ["string", "null"],
      "format": "date"
    },
    "paymentPeriodEndDate": {
      "type": ["string", "null"],
      "format": "date"
    },
    "employeeName": {
      "type": ["string", "null"]
    },
    "customProjectCode": {
      "type": ["string", "null"]
    },
    "receiver": {
      "type": "object",
      "properties": {
        "profitCenterCode": {
          "type": ["integer", "null"]
        },
        "bankAccount": {
          "type": "object",
          "properties": {
            "value": {
              "type": "string",
              "maxLength": 34
            },
            "bicCode": {
              "type": "string",
              "maxLength": 11
            }
          },
          "required": ["value", "bicCode"]
        },
        "name": {
          "type": "object",
          "properties": {
            "firstName": {
              "type": "string"
            },
            "lastName": {
              "type": "string"
            }
          },
          "required": ["firstName", "lastName"]
        },
        "socialSecurityNumber": {
          "type": ["string", "null"],
          "maxLength": 11
        },
        "businessId": {
          "type": ["string", "null"],
          "maxLength": 9
        },
        "employerIdentifier": {
          "type": ["string", "null"]
        },
        "postalAddress": {
          "type": "object",
          "properties": {
            "addressLine": {
              "type": ["array", "null"],
              "items": {
                "type": ["string", "null"]
              }
            },
            "postalCode": {
              "type": ["string", "null"],
              "maxLength": 5
            },
            "postOffice": {
              "type": ["string", "null"]
            },
            "country": {
              "type": "string",
              "maxLength": 2
            }
          },
          "required": ["country"]
        },
        "number": {
          "type": ["integer", "null"]
        }
      },
      "required": ["bankAccount", "name"]
    },
    "posting": {
      "type": "object",
      "properties": {
        "postingInstallment": {
          "type": "array",
          "items": {
            "type": "object",
            "properties": {
              "sum": {
                "type": "number",
                "minimum": 0
              },
              "businessBookkeepingAccount": {
                "type": ["integer", "null"]
              },
              "financeAssessmentAccount": {
                "type": ["integer", "null"]
              },
              "followUpCode1": {
                "type": ["integer", "null"]
              },
              "followUpCode2": {
                "type": ["integer", "null"]
              },
              "partnerCode": {
                "type": ["string", "null"]
              },
              "functionCode": {
                "type": ["string", "null"]
              },
              "ovt": {
                "type": ["string", "null"]
              },
              "operationUnit": {
                "type": ["integer", "null"]
              },
              "projectCode": {
                "type": ["string", "null"]
              },
              "municipalityCode": {
                "type": "string",
                "maxLength": 3
              },
              "vatCode": {
                "type": "string",
                "maxLength": 4
              }
            },
            "required": ["sum", "municipalityCode", "vatCode"]
          }
        },
        "accountsLedgerReceiptType": {
          "type": "string",
          "maxLength": 2
        }
      },
      "required": ["accountsLedgerReceiptType"]
    },
    "view": {
      "type": "object",
      "properties": {
        "type": {
          "type": ["string", "null"]
        },
        "roadName": {
          "type": ["string", "null"]
        },
        "roadId": {
          "type": ["string", "null"]
        },
        "usePriviledgeUnitId": {
          "type": ["string", "null"]
        },
        "municipality": {
          "type": "object",
          "properties": {
            "value": {
              "type": ["string", "null"]
            },
            "code": {
              "type": ["string", "null"],
              "maxLength": 3
            }
          }
        },
        "paymentDecisionRecordNumber": {
          "type": "string"
        },
        "paymentDecisionDate": {
          "type": "string",
          "format": "date"
        },
        "grantDecisionRecordNumber": {
          "type": "string"
        },
        "businessUnit": {
          "type": "object",
          "properties": {
            "value": {
              "type": "string"
            },
            "code": {
              "type": "integer",
              "minimum": 0
            }
          },
          "required": ["value", "code"]
        },
        "creator": {
          "type": "object",
          "properties": {
            "name": {
              "type": "object",
              "properties": {
                "firstName": {
                  "type": "string"
                },
                "lastName": {
                  "type": "string"
                }
              },
              "required": ["firstName", "lastName"]
            }
          },
          "required": ["name"]
        },
        "paymentSubjectInspector": {
          "type": "object",
          "properties": {
            "name": {
              "type": "object",
              "properties": {
                "firstName": {
                  "type": "string"
                },
                "lastName": {
                  "type": "string"
                }
              },
              "required": ["firstName", "lastName"]
            },
            "email": {
              "type": "object",
              "properties": {
                "value": {
                  "type": "string"
                }
              },
              "required": ["value"]
            }
          },
          "required": ["name", "email"]
        },
        "verifyDate": {
          "type": "string",
          "format": "date"
        },
        "paymentPresenter": {
          "type": "object",
          "properties": {
            "name": {
              "type": "object",
              "properties": {
                "firstName": {
                  "type": "string"
                },
                "lastName": {
                  "type": "string"
                }
              },
              "required": ["firstName", "lastName"]
            },
            "email": {
              "type": "object",
              "properties": {
                "value": {
                  "type": "string"
                }
              },
              "required": ["value"]
            },
            "signedTime": {
              "type": "string",
              "format": "date"
            }
          },
          "required": ["name", "email", "signedTime"]
        },
        "paymentAcceptor": {
          "type": "object",
          "properties": {
            "name": {
              "type": "object",
              "properties": {
                "firstName": {
                  "type": "string"
                },
                "lastName": {
                  "type": "string"
                }
              },
              "required": ["firstName", "lastName"]
            },
            "email": {
              "type": "object",
              "properties": {
                "value": {
                  "type": "string"
                }
              },
              "required": ["value"]
            },
            "signedTime": {
              "type": "string",
              "format": "date"
            }
          },
          "required": ["name", "email", "signedTime"]
        },
        "additionalInformation": {
          "type": "string"
        },
        "rows": {
          "type": "object",
          "properties": {
            "row": {
              "type": "array",
              "items": {
                "type": "object",
                "properties": {
                  "description": {
                    "type": "string"
                  },
                  "grossSum": {
                    "type": "number",
                    "minimum": 0
                  },
                  "vatPercentage": {
                    "type": "integer",
                    "minimum": 0,
                    "maximum": 100
                  },
                  "vatSum": {
                    "type": "number",
                    "minimum": 0
                  },
                  "netSum": {
                    "type": "number",
                    "minimum": 0
                  }
                },
                "required": ["description", "grossSum", "vatPercentage", "vatSum", "netSum"]
              }
            }
          },
          "required": ["row"]
        },
        "vatSum": {
          "type": "number",
          "minimum": 0
        },
        "netSum": {
          "type": "number",
          "minimum": 0
        },
        "aidType": {
          "type": "string"
        },
        "language": {
          "type": "integer"
        }
      },
      "required": [
        "paymentDecisionRecordNumber",
        "paymentDecisionDate",
        "grantDecisionRecordNumber",
        "verifyDate",
        "businessUnit",
        "additionalInformation",
        "vatSum",
        "netSum",
        "aidType",
        "language"
      ]
    },
    "version": {
      "type": ["string", "null"]
    },
    "claimType": {
      "type": "string"
    },
    "auraAccount": {
      "type": "string"
    },
    "sectorIdentifier": {
      "type": "string"
    },
    "serviceProviderSectorIdentifier": {
      "type": ["string", "null"]
    },
    "participantHomeMunicipality": {
      "type": ["string", "null"],
      "maxLength": 3
    },
    "recipientMunicipality": {
      "type": "string",
      "maxLength": 3
    },
    "employmentMunicipality": {
      "type": ["string", "null"],
      "maxLength": 3
    },
    "payerBusinessId": {
      "type": ["string", "null"],
      "maxLength": 9
    },
    "acculturingStatus": {
      "type": ["boolean", "null"]
    },
    "contractAcculturingStatus": {
      "type": ["boolean", "null"]
    },
    "originalInvoiceNumber": {
      "type": ["string", "null"]
    },
    "originalBuyerReferenceIdentifier": {
      "type": ["string", "null"]
    },
    "euGlobalizationFundDetails": {
      "type": ["object", "null"],
      "properties": {
        "euGlobalizationFundRows": {
          "type": "array",
          "items": {
            "type": "object",
            "properties": {
              "globazationFundCode": {
                "type": "string"
              },
              "municipalityCode": {
                "type": "string",
                "maxLength": 3
              },
              "sum": {
                "type": "number",
                "minimum": 0
              },
              "vatCode": {
                "type": "string",
                "maxLength": 4
              }
            }
          }
        }
      }
    },
    "abruptStructuralChangeDetails": {
      "type": ["object", "null"],
      "properties": {
        "abruptStructuralChangeRows": {
          "type": "array",
          "items": {
            "type": "object",
            "properties": {
              "abruptStructuralChangeCode": {
                "type": "string"
              },
              "municipalityCode": {
                "type": "string",
                "maxLength": 3
              },
              "sum": {
                "type": "number",
                "minimum": 0
              },
              "vatCode": {
                "type": "string",
                "maxLength": 4
              }
            }
          }
        }
      }
    }
  },
  "required": [
    "delivery",
    "bizTalkPipe",
    "invoiceNumber",
    "invoiceDate",
    "dueDate",
    "receiptDate",
    "grossSum",
    "currency",
    "ourReference",
    "receiver",
    "posting",
    "view",
    "version",
    "claimType",
    "auraAccount",
    "sectorIdentifier",
    "recipientMunicipality"
  ]
}