{
    "delivery": {
        "fileName": "YA_p24_091_20241031000002_2_HKK.json",
        "id": 60025900,
        "sentAt": "2024-10-31 00:00:02",
        "from": "YA",
        "to": "RONDO"
    },
    "bizTalkPipe": "automatic",
    "invoiceNumber": 60025900,
    "invoiceDate": "2024-10-30 00:00:00",
    "dueDate": "2024-11-03 00:00:00",
    "receiptDate": "2024-10-30 00:00:00",
    "grossSum": 198,
    "currency": "EUR",
    "ourReference": "Kulukorvaus HKK/24154/2024 maksuerä 1/1",
    "customerBankReference": null,
    "periodStartDate": "2024-09-01 00:00:00",
    "periodEndDate": "2024-09-30 00:00:00",
    "paymentPeriodStartDate": null,
    "paymentPeriodEndDate": null,
    "employeeName": null,
    "customProjectCode": null,
    "receiver": {
        "profitCenterCode": 5086,
        "bankAccount": {
            "value": "FI4439289980006088",
            "bicCode": "SBANFIHH"
        },
        "name": {
            "firstName": "Mari",
            "lastName": "Makkonen"
        },
        "socialSecurityNumber": "060589-236F",
        "businessId": null,
        "postalAddress": {
            "addressLine": [
                "Keskuskatu 1"
            ],
            "postalCode": "00100",
            "postOffice": "Helsinki",
            "country": "FI"
        },
        "number": 90060
    },
    "posting": {
        "postingInstallment": [
            {
                "sum": 198,
                "businessBookkeepingAccount": 82620000,
                "financeAssessmentAccount": 42332305109,
                "followUpCode1": 38025112,
                "followUpCode2": null,
                "partnerCode": null,
                "functionCode": null,
                "ovt": null,
                "operationUnit": 3800114101,
                "projectCode": "5086YA0045",
                "municipalityCode": "091",
                "vatCode": "0000",
                "acculturingStatus": null
            }
        ],
        "accountsLedgerReceiptType": "YA"
    },
    "view": {
        "type": "Harkinnanvarainen kulukorvaus",
        "roadName": "5086YA0045",
        "roadId": null,
        "usePriviledgeUnitId": null,
        "municipality": {
            "value": "Helsinki",
            "code": "091"
        },
        "paymentDecisionRecordNumber": "HKK/24154/2024",
        "paymentDecisionDate": "2024-10-30 00:00:00",
        "grantDecisionRecordNumber": "HKK/24154/2024",
        "businessUnit": {
            "value": "HELSINGIN KAUPUNKI",
            "code": 91
        },
        "creator": {
            "name": {
                "firstName": "Maija",
                "lastName": "Maijanen"
            }
        },
        "paymentSubjectInspector": {
            "name": {
                "firstName": "Maija",
                "lastName": "Maijanen"
            },
            "email": {
                "value": "Maija.Maijanen@testi.fi"
            }
        },
        "verifyDate": "2024-10-30 13:48:44",
        "paymentPresenter": {
            "name": {
                "firstName": "Maija",
                "lastName": "Maijanen"
            },
            "email": {
                "value": "Maija.Maijanen@testi.fi"
            },
            "phoneNumber": "-",
            "signedTime": "2024-10-30 13:48:51"
        },
        "paymentAcceptor": {
            "name": {
                "firstName": "Maija",
                "lastName": "Maijanen"
            },
            "email": {
                "value": "Maija.Maijanen@testi.fi"
            },
            "phoneNumber": null,
            "signedTime": "2024-10-30 13:48:48"
        },
        "additionalInformation": "Harkinnanvaraiset kulukorvaukset: 5086YA0045. Myöntöpäätös: 30.10.2024. 5555.",
        "rows": {
            "row": [
                {
                    "description": "Harkinnanvarainen kulukorvaus",
                    "grossSum": 198,
                    "vatPercentage": 0,
                    "vatSum": 0,
                    "netSum": 198
                }
            ]
        },
        "vatSum": 0,
        "netSum": 198,
        "aidType": "00",
        "language": 1
    },
    "version": "2.3",
    "claimType": "HARKINNANVARAINEN_KULUKORVAUS",
    "auraAccount": "4739",
    "sectorIdentifier": "S.14",
    "participantHomeMunicipality": "091",
    "recipientMunicipality": "091",
    "employmentMunicipality": "091",
    "payerBusinessId": "0201256-6",
    "acculturingStatus": false
}