{"delivery":{"fileName":"YA_p24_091_20241031100100_0_TOJT.json","id":60025917,"sentAt":"2024-10-31 10:01:00","from":"YA","to":"RONDO"},"bizTalkPipe":"automatic","invoiceNumber":60025917,"invoiceDate":"2024-10-31 00:00:00","dueDate":"2024-11-03 00:00:00","receiptDate":"2024-10-31 00:00:00","grossSum":1255.0,"currency":"EUR","ourReference":"Hakemus työolosuhteiden järjestelytuesta TOJT/24170/2024 maksuerä 1/1","customerBankReference":null,"periodStartDate":"2024-10-31 00:00:00","periodEndDate":"2024-12-31 00:00:00","paymentPeriodStartDate":"2024-10-01 00:00:00","paymentPeriodEndDate":"2024-10-31 00:00:00","employeeName":null,"customProjectCode":null,"receiver":{"profitCenterCode":5086,"bankAccount":{"value":"FI3952900240167500","bicCode":"OKOYFIHH"},"name":{"firstName":"Testifirma OY","lastName":""},"socialSecurityNumber":null,"businessId":"8262500-3","postalAddress":{"addressLine":["Testikatu 1"],"postalCode":"00100","postOffice":"Helsinki","country":"FI"},"number":90060},"posting":{"postingInstallment":[{"sum":1255.0,"businessBookkeepingAccount":82310000,"financeAssessmentAccount":42332305109,"followUpCode1":38025110,"followUpCode2":null,"partnerCode":null,"functionCode":null,"ovt":null,"operationUnit":3800114101,"projectCode":"5086YA0056","municipalityCode":"091","vatCode":"0000","acculturingStatus":null}],"accountsLedgerReceiptType":"YA"},"view":{"type":"Työolosuhteiden järjestelytuki","roadName":"5086YA0056","roadId":null,"usePriviledgeUnitId":null,"municipality":{"value":"Helsinki","code":"091"},"paymentDecisionRecordNumber":"TOJT/24170/2024","paymentDecisionDate":"2024-10-31 00:00:00","grantDecisionRecordNumber":"TOJT/24170/2024","businessUnit":{"value":"HELSINGIN KAUPUNKI","code":91},"creator":{"name":{"firstName":"Emilia","lastName":"Kujala"}},"paymentSubjectInspector":{"name":{"firstName":"Emilia","lastName":"Kujala"},"email":{"value":"emilia.kujala@ely-keskus.fi"}},"verifyDate":"2024-10-31 09:59:26","paymentPresenter":{"name":{"firstName":"Emilia","lastName":"Kujala"},"email":{"value":"emilia.kujala@ely-keskus.fi"},"phoneNumber":"-","signedTime":"2024-10-31 09:59:15"},"paymentAcceptor":{"name":{"firstName":"Mari","lastName":"Voutilainen"},"email":{"value":"mari.voutilainen@ely-keskus.fi"},"phoneNumber":null,"signedTime":"2024-10-31 10:00:06"},"additionalInformation":"Työolosuhteiden järjestelytukihakemuksen tuki: 5086YA0056. Myöntöpäätös: 31.10.2024. 5555. Kustannuksia haettu 01.10.2024 - 31.10.2024.","rows":{"row":[{"description":"Työolosuhteiden järjestelytuki","grossSum":1255.0,"vatPercentage":0,"vatSum":0,"netSum":1255.0}]},"vatSum":0,"netSum":1255.0,"aidType":"99","language":1},"version":"2.3","claimType":"TYOOLOSUHTEIDEN_JARJESTELYTUKI","auraAccount":"4300","sectorIdentifier":"S.11","participantHomeMunicipality":"091","recipientMunicipality":"091","employmentMunicipality":"091","payerBusinessId":"0201256-6","acculturingStatus":false}