{"delivery":{"fileName":"YA_p24_091_20241031115100_0_PT.json","id":60025925,"sentAt":"2024-10-31 11:51:00","from":"YA","to":"RONDO"},"bizTalkPipe":"automatic","invoiceNumber":60025925,"invoiceDate":"2024-10-31 00:00:00","dueDate":"2024-11-02 00:00:00","receiptDate":"2024-10-31 00:00:00","grossSum":1250.0,"currency":"EUR","ourReference":"Palkkatuki PT/24172/2024","customerBankReference":"12 34561","periodStartDate":"2024-07-01 00:00:00","periodEndDate":"2024-10-31 00:00:00","paymentPeriodStartDate":"2024-09-01 00:00:00","paymentPeriodEndDate":"2024-09-30 00:00:00","employeeName":"Seppo Sepomäkinen","customProjectCode":"12345","receiver":{"profitCenterCode":5086,"bankAccount":{"value":"FI3952900240167500","bicCode":"OKOYFIHH"},"name":{"firstName":"Helsingin kuppi","lastName":""},"socialSecurityNumber":"210218-265B","businessId":"6631305-0","postalAddress":{"addressLine":["Testikatu 1"],"postalCode":"00100","postOffice":"Helsinki","country":"FI"},"number":90055},"posting":{"postingInstallment":[{"sum":1250.0,"businessBookkeepingAccount":82310000,"financeAssessmentAccount":202402024,"followUpCode1":null,"followUpCode2":38099272,"partnerCode":null,"functionCode":null,"ovt":null,"operationUnit":1,"projectCode":"5086YA0058","municipalityCode":"091","vatCode":"0000","acculturingStatus":null}],"accountsLedgerReceiptType":"YA"},"view":{"type":"Palkkatukihakemuksen tuki","roadName":"5086YA0058","roadId":null,"usePriviledgeUnitId":null,"municipality":{"value":"Helsinki","code":"091"},"paymentDecisionRecordNumber":"PT/24172/2024","paymentDecisionDate":"2024-10-31 00:00:00","grantDecisionRecordNumber":"PT/24172/2024","businessUnit":{"value":"HELSINGIN KAUPUNKI","code":91},"creator":{"name":{"firstName":"Emma","lastName":"Virtanen"}},"paymentSubjectInspector":{"name":{"firstName":"Emma","lastName":"Virtanen"},"email":{"value":"Emma.Virtanen@email.com"}},"verifyDate":"2024-10-31 11:50:40","paymentPresenter":{"name":{"firstName":"Emma","lastName":"Virtanen"},"email":{"value":"Emma.Virtanen@email.com"},"phoneNumber":"-","signedTime":"2024-10-31 11:47:10"},"paymentAcceptor":{"name":{"firstName":"Emma","lastName":"Virtanen"},"email":{"value":"Emma.Virtanen@email.com"},"phoneNumber":null,"signedTime":"2024-10-31 11:50:47"},"additionalInformation":"Palkkatukihakemuksen tuki: 5086YA0058. Myöntöpäätös: 31.10.2024. 202402024/2024. Kustannuksia haettu 01.09.2024 - 30.09.2024.","rows":{"row":[{"description":"Palkkatukihakemuksen tuki erä 3-2024","grossSum":1250.0,"vatPercentage":0,"vatSum":0,"netSum":1250.0}]},"vatSum":0,"netSum":1250.0,"aidType":"6T","language":1},"version":"2.3","claimType":"PALKKATUKI","auraAccount":"4746","sectorIdentifier":"S.11","participantHomeMunicipality":"091","recipientMunicipality":"091","employmentMunicipality":"091","payerBusinessId":"0201256-6","acculturingStatus":false}