{"delivery":{"fileName":"YA_p24_091_20241031000005_12_HKK.json","id":60025912,"sentAt":"2024-10-31 00:00:05","from":"YA","to":"RONDO"},"bizTalkPipe":"automatic","invoiceNumber":60025912,"invoiceDate":"2024-10-30 00:00:00","dueDate":"2024-11-03 00:00:00","receiptDate":"2024-10-30 00:00:00","grossSum":198.0,"currency":"EUR","ourReference":"Kulukorvaus HKK/24165/2024 maksuerä 1/1","customerBankReference":null,"periodStartDate":"2024-09-01 00:00:00","periodEndDate":"2024-09-30 00:00:00","paymentPeriodStartDate":null,"paymentPeriodEndDate":null,"employeeName":null,"customProjectCode":null,"receiver":{"profitCenterCode":5086,"bankAccount":{"value":"FI7447424428000621","bicCode":"POPFFI22"},"name":{"firstName":"Maija","lastName":"Mehiläinen"},"socialSecurityNumber":"090884-772U","businessId":null,"postalAddress":{"addressLine":["Luopatie 8"],"postalCode":"02310","postOffice":"Helsinki","country":"FI"},"number":90060},"posting":{"postingInstallment":[{"sum":198.0,"businessBookkeepingAccount":82620000,"financeAssessmentAccount":42332305109,"followUpCode1":38025112,"followUpCode2":null,"partnerCode":null,"functionCode":null,"ovt":null,"operationUnit":3800114101,"projectCode":"5086YA0053","municipalityCode":"091","vatCode":"0000","acculturingStatus":null}],"accountsLedgerReceiptType":"YA"},"view":{"type":"Harkinnanvarainen kulukorvaus","roadName":"5086YA0053","roadId":null,"usePriviledgeUnitId":null,"municipality":{"value":"Helsinki","code":"091"},"paymentDecisionRecordNumber":"HKK/24165/2024","paymentDecisionDate":"2024-10-30 00:00:00","grantDecisionRecordNumber":"HKK/24165/2024","businessUnit":{"value":"HELSINGIN KAUPUNKI","code":91},"creator":{"name":{"firstName":"Maija","lastName":"Mäkelä"}},"paymentSubjectInspector":{"name":{"firstName":"Maija","lastName":"Mäkelä"},"email":{"value":"Maija.Mäkelä@email.com"}},"verifyDate":"2024-10-30 15:15:39","paymentPresenter":{"name":{"firstName":"Maija","lastName":"Mäkelä"},"email":{"value":"Maija.Mäkelä@email.com"},"phoneNumber":"-","signedTime":"2024-10-30 15:15:44"},"paymentAcceptor":{"name":{"firstName":"Maija","lastName":"Mäkelä"},"email":{"value":"Maija.Mäkelä@email.com"},"phoneNumber":null,"signedTime":"2024-10-30 15:15:42"},"additionalInformation":"Harkinnanvaraiset kulukorvaukset: 5086YA0053. Myöntöpäätös: 30.10.2024. 5555.","rows":{"row":[{"description":"Harkinnanvarainen kulukorvaus","grossSum":198.0,"vatPercentage":0,"vatSum":0,"netSum":198.0}]},"vatSum":0,"netSum":198.0,"aidType":"00","language":1},"version":"2.3","claimType":"HARKINNANVARAINEN_KULUKORVAUS","auraAccount":"4739","sectorIdentifier":"S.14","participantHomeMunicipality":"091","recipientMunicipality":"091","employmentMunicipality":"091","payerBusinessId":"0201256-6","acculturingStatus":false}