[{"delivery":{"fileName":"YA_p24_091_20241031000002_2_HKK.json","id":60025900,"sentAt":"2024-10-31 00:00:02","from":"YA","to":"RONDO"},"bizTalkPipe":"automatic","invoiceNumber":60025900,"invoiceDate":"2024-10-30 00:00:00","dueDate":"2024-11-03 00:00:00","receiptDate":"2024-10-30 00:00:00","grossSum":198.0,"currency":"EUR","ourReference":"Kulukorvaus HKK/24154/2024 maksuerä 1/1","customerBankReference":null,"periodStartDate":"2024-09-01 00:00:00","periodEndDate":"2024-09-30 00:00:00","paymentPeriodStartDate":null,"paymentPeriodEndDate":null,"employeeName":null,"customProjectCode":null,"receiver":{"profitCenterCode":5086,"bankAccount":{"value":"FI4439289980006088","bicCode":"SBANFIHH"},"name":{"firstName":"Mari","lastName":"Makkonen"},"socialSecurityNumber":"060589-236F","businessId":null,"postalAddress":{"addressLine":["Keskuskatu 1"],"postalCode":"00100","postOffice":"Helsinki","country":"FI"},"number":90060},"posting":{"postingInstallment":[{"sum":198.0,"businessBookkeepingAccount":82620000,"financeAssessmentAccount":42332305109,"followUpCode1":38025112,"followUpCode2":null,"partnerCode":null,"functionCode":null,"ovt":null,"operationUnit":3800114101,"projectCode":"5086YA0045","municipalityCode":"091","vatCode":"0000","acculturingStatus":null}],"accountsLedgerReceiptType":"YA"},"view":{"type":"Harkinnanvarainen kulukorvaus","roadName":"5086YA0045","roadId":null,"usePriviledgeUnitId":null,"municipality":{"value":"Helsinki","code":"091"},"paymentDecisionRecordNumber":"HKK/24154/2024","paymentDecisionDate":"2024-10-30 00:00:00","grantDecisionRecordNumber":"HKK/24154/2024","businessUnit":{"value":"HELSINGIN KAUPUNKI","code":91},"creator":{"name":{"firstName":"Maija","lastName":"Maijanen"}},"paymentSubjectInspector":{"name":{"firstName":"Maija","lastName":"Maijanen"},"email":{"value":"Maija.Maijanen@testi.fi"}},"verifyDate":"2024-10-30 13:48:44","paymentPresenter":{"name":{"firstName":"Maija","lastName":"Maijanen"},"email":{"value":"Maija.Maijanen@testi.fi"},"phoneNumber":"-","signedTime":"2024-10-30 13:48:51"},"paymentAcceptor":{"name":{"firstName":"Maija","lastName":"Maijanen"},"email":{"value":"Maija.Maijanen@testi.fi"},"phoneNumber":null,"signedTime":"2024-10-30 13:48:48"},"additionalInformation":"Harkinnanvaraiset kulukorvaukset: 5086YA0045. Myöntöpäätös: 30.10.2024. 5555.","rows":{"row":[{"description":"Harkinnanvarainen kulukorvaus","grossSum":198.0,"vatPercentage":0,"vatSum":0,"netSum":198.0}]},"vatSum":0,"netSum":198.0,"aidType":"00","language":1},"version":"2.3","claimType":"HARKINNANVARAINEN_KULUKORVAUS","auraAccount":"4739","sectorIdentifier":"S.14","participantHomeMunicipality":"091","recipientMunicipality":"091","employmentMunicipality":"091","payerBusinessId":"0201256-6","acculturingStatus":false},{"delivery":{"fileName":"YA_p24_091_20241031000001_0_MYK.json","id":60025897,"sentAt":"2024-10-31 00:00:01","from":"YA","to":"RONDO"},"bizTalkPipe":"automatic","invoiceNumber":60025897,"invoiceDate":"2024-10-30 00:00:00","dueDate":"2024-11-03 00:00:00","receiptDate":"2024-10-30 00:00:00","grossSum":115.25,"currency":"EUR","ourReference":"Matka- ja yöpymiskustannusten korvaus MYK/24150/2024 maksuerä 1/1","customerBankReference":null,"periodStartDate":"2024-10-01 00:00:00","periodEndDate":"2024-10-02 00:00:00","paymentPeriodStartDate":null,"paymentPeriodEndDate":null,"employeeName":null,"customProjectCode":null,"receiver":{"profitCenterCode":5086,"bankAccount":{"value":"FI0280001800223340","bicCode":"DABAFIHH"},"name":{"firstName":"Ville","lastName":"Villinen"},"socialSecurityNumber":"210694-433L","businessId":null,"postalAddress":{"addressLine":["Testikatu 1"],"postalCode":"00100","postOffice":"Helsinki","country":"FI"},"number":90060},"posting":{"postingInstallment":[{"sum":115.25,"businessBookkeepingAccount":82620000,"financeAssessmentAccount":42332305109,"followUpCode1":38025110,"followUpCode2":null,"partnerCode":null,"functionCode":null,"ovt":null,"operationUnit":3800114101,"projectCode":"5086YA0042","municipalityCode":"091","vatCode":"0000","acculturingStatus":null}],"accountsLedgerReceiptType":"YA"},"view":{"type":"Matka- ja yöpymiskustannusten korvaus","roadName":"5086YA0042","roadId":null,"usePriviledgeUnitId":null,"municipality":{"value":"Helsinki","code":"091"},"paymentDecisionRecordNumber":"MYK/24150/2024","paymentDecisionDate":"2024-10-30 00:00:00","grantDecisionRecordNumber":"MYK/24150/2024","businessUnit":{"value":"HELSINGIN KAUPUNKI","code":91},"creator":{"name":{"firstName":"Maija","lastName":"Maijanen"}},"paymentSubjectInspector":{"name":{"firstName":"Maija","lastName":"Maijanen"},"email":{"value":"Maija.Maijanen@testi.fi"}},"verifyDate":"2024-10-30 12:12:18","paymentPresenter":{"name":{"firstName":"Maija","lastName":"Maijanen"},"email":{"value":"Maija.Maijanen@testi.fi"},"phoneNumber":"-","signedTime":"2024-10-30 12:12:18"},"paymentAcceptor":{"name":{"firstName":"Maija","lastName":"Maijanen"},"email":{"value":"Maija.Maijanen@testi.fi"},"phoneNumber":null,"signedTime":"2024-10-30 12:12:32"},"additionalInformation":"Matka- ja yöpymiskustannusten korvaus: 5086YA0042. Myöntöpäätös: 30.10.2024. 5555.","rows":{"row":[{"description":"Matka- ja yöpymiskustannusten korvaus","grossSum":115.25,"vatPercentage":0,"vatSum":0,"netSum":115.25}]},"vatSum":0,"netSum":115.25,"aidType":"99","language":1},"version":"2.3","claimType":"MATKA_JA_YOPYMISKUSTANNUSTENKORVAUS","auraAccount":"4739","sectorIdentifier":"S.14","participantHomeMunicipality":"091","recipientMunicipality":"091","employmentMunicipality":"091","payerBusinessId":"0201256-6","acculturingStatus":false},{"delivery":{"fileName":"YA_p24_091_20241031000001_1_MYK.json","id":60025898,"sentAt":"2024-10-31 00:00:01","from":"YA","to":"RONDO"},"bizTalkPipe":"automatic","invoiceNumber":60025898,"invoiceDate":"2024-10-30 00:00:00","dueDate":"2024-11-03 00:00:00","receiptDate":"2024-10-30 00:00:00","grossSum":105.59,"currency":"EUR","ourReference":"Matka- ja yöpymiskustannusten korvaus MYK/24151/2024 maksuerä 1/1","customerBankReference":null,"periodStartDate":"2024-10-01 00:00:00","periodEndDate":"2024-10-02 00:00:00","paymentPeriodStartDate":null,"paymentPeriodEndDate":null,"employeeName":null,"customProjectCode":null,"receiver":{"profitCenterCode":5086,"bankAccount":{"value":"FI0280001800223340","bicCode":"DABAFIHH"},"name":{"firstName":"Kukka","lastName":"Kukkanen"},"socialSecurityNumber":"221253-7613","businessId":null,"postalAddress":{"addressLine":["Testikatu 1"],"postalCode":"00100","postOffice":"Helsinki","country":"FI"},"number":90060},"posting":{"postingInstallment":[{"sum":105.59,"businessBookkeepingAccount":82620000,"financeAssessmentAccount":42332305109,"followUpCode1":38025110,"followUpCode2":null,"partnerCode":null,"functionCode":null,"ovt":null,"operationUnit":3800114101,"projectCode":"5086YA0043","municipalityCode":"091","vatCode":"0000","acculturingStatus":null}],"accountsLedgerReceiptType":"YA"},"view":{"type":"Matka- ja yöpymiskustannusten korvaus","roadName":"5086YA0043","roadId":null,"usePriviledgeUnitId":null,"municipality":{"value":"Helsinki","code":"091"},"paymentDecisionRecordNumber":"MYK/24151/2024","paymentDecisionDate":"2024-10-30 00:00:00","grantDecisionRecordNumber":"MYK/24151/2024","businessUnit":{"value":"HELSINGIN KAUPUNKI","code":91},"creator":{"name":{"firstName":"Maija","lastName":"Maijanen"}},"paymentSubjectInspector":{"name":{"firstName":"Maija","lastName":"Maijanen"},"email":{"value":"Maija.Maijanen@testi.fi"}},"verifyDate":"2024-10-30 12:18:00","paymentPresenter":{"name":{"firstName":"Maija","lastName":"Maijanen"},"email":{"value":"Maija.Maijanen@testi.fi"},"phoneNumber":"-","signedTime":"2024-10-30 12:18:00"},"paymentAcceptor":{"name":{"firstName":"Maija","lastName":"Maijanen"},"email":{"value":"Maija.Maijanen@testi.fi"},"phoneNumber":null,"signedTime":"2024-10-30 12:18:09"},"additionalInformation":"Matka- ja yöpymiskustannusten korvaus: 5086YA0043. Myöntöpäätös: 30.10.2024. 5555.","rows":{"row":[{"description":"Matka- ja yöpymiskustannusten korvaus","grossSum":105.59,"vatPercentage":0,"vatSum":0,"netSum":105.59}]},"vatSum":0,"netSum":105.59,"aidType":"99","language":1},"version":"2.3","claimType":"MATKA_JA_YOPYMISKUSTANNUSTENKORVAUS","auraAccount":"4739","sectorIdentifier":"S.14","participantHomeMunicipality":"091","recipientMunicipality":"091","employmentMunicipality":"091","payerBusinessId":"0201256-6","acculturingStatus":false}]